{
  "visa_code": "K-3",
  "visa_subtype": null,
  "subtype": null,
  "official_name": "Nonimmigrant Visa for a Spouse of a U.S. Citizen",
  "visa_family": "nonimmigrant",
  "category_group": null,
  "jurisdiction": "United States",
  "purpose": "Spousal entry under the K-3 framework while immigrant processing remains pending where applicable.",
  "who_can_apply": [],
  "petitioner_required": true,
  "sponsor_required": true,
  "petition_form": [],
  "labor_certification_required": null,
  "lca_required": null,
  "uscis_petition_required": true,
  "sevis_required": null,
  "sevis_program_sponsorship_required": null,
  "treaty_required": null,
  "treaty_nationality_required": null,
  "treaty_nationalities": [],
  "treaty_nationality_note": null,
  "derivative_visas": [],
  "derivative_categories": [],
  "work_authorization": true,
  "work_authorized": true,
  "study_authorization": false,
  "study_authorized": false,
  "dual_intent": null,
  "cap_quota_status": "none",
  "numerical_cap": null,
  "lottery_based": false,
  "lottery_notes": null,
  "visa_bulletin_applicable": false,
  "aos_chart_behavior": null,
  "adjustment_of_status_possible": true,
  "consular_processing_possible": true,
  "initial_validity": null,
  "extension_renewal_basics": "K-3 processing depends on the underlying spousal petition framework.",
  "extension_rules": "K-3 processing depends on the underlying spousal petition framework.",
  "premium_processing_possible": null,
  "core_eligibility_requirements": [
    "Qualifying U.S. citizen spouse",
    "Underlying petition framework",
    "Consular processing requirements"
  ],
  "hard_disqualifiers": [
    "Spousal petition defects",
    "Relationship ineligibility"
  ],
  "required_documents": [
    "Passport",
    "DS-160",
    "Petition evidence",
    "Civil documents"
  ],
  "common_denial_reasons": [
    "Petition framework not properly established",
    "Insufficient relationship documentation"
  ],
  "official_forms": [
    "I-130",
    "I-129F",
    "DS-160"
  ],
  "official_source_urls": [
    "https://travel.state.gov/content/travel/en/us-visas/visa-information-resources/all-visa-categories.html",
    "https://travel.state.gov/content/travel/en/us-visas/immigrate/family-immigration/nonimmigrant-visa-for-a-spouse-k-3.html"
  ],
  "source_notes": [],
  "last_verified_at": "2026-04-04T00:00:00Z",
  "subtype_notes": null,
  "confidence": "high",
  "confidence_level": "high",
  "confidence_basis": "Directly stated on a category-specific official U.S. government page or an official category page plus a directly applicable USCIS/State process page.",
  "validation_notes": [],
  "source_version": "us_official_seed_2026-04-04_v1",
  "requires_human_review": false
}
