{
  "visa_code": "O-1",
  "visa_subtype": null,
  "subtype": null,
  "official_name": "Individual with Extraordinary Ability or Achievement",
  "visa_family": "nonimmigrant",
  "category_group": null,
  "jurisdiction": "United States",
  "purpose": "Temporary work for individuals with extraordinary ability or achievement.",
  "who_can_apply": [],
  "petitioner_required": true,
  "sponsor_required": true,
  "petition_form": [],
  "labor_certification_required": null,
  "lca_required": null,
  "uscis_petition_required": true,
  "sevis_required": null,
  "sevis_program_sponsorship_required": null,
  "treaty_required": null,
  "treaty_nationality_required": null,
  "treaty_nationalities": [],
  "treaty_nationality_note": null,
  "derivative_visas": [],
  "derivative_categories": [],
  "work_authorization": true,
  "work_authorized": true,
  "study_authorization": false,
  "study_authorized": false,
  "dual_intent": null,
  "cap_quota_status": "none",
  "numerical_cap": null,
  "lottery_based": false,
  "lottery_notes": null,
  "visa_bulletin_applicable": false,
  "aos_chart_behavior": null,
  "adjustment_of_status_possible": true,
  "consular_processing_possible": true,
  "initial_validity": null,
  "extension_renewal_basics": "Extensions are tied to the events, activities, or work authorized by the petition.",
  "extension_rules": "Extensions are tied to the events, activities, or work authorized by the petition.",
  "premium_processing_possible": null,
  "core_eligibility_requirements": [
    "Extraordinary ability or achievement evidence",
    "Petitioning U.S. employer or agent",
    "Advisory opinion where required"
  ],
  "hard_disqualifiers": [
    "Evidence threshold not met"
  ],
  "required_documents": [
    "Passport",
    "Form I-129 support",
    "Extraordinary ability evidence",
    "Petition approval"
  ],
  "common_denial_reasons": [
    "Evidence threshold not met",
    "Insufficient advisory or support documentation"
  ],
  "official_forms": [
    "I-129",
    "DS-160"
  ],
  "official_source_urls": [
    "https://travel.state.gov/content/travel/en/us-visas/visa-information-resources/all-visa-categories.html"
  ],
  "source_notes": [],
  "last_verified_at": "2026-04-04T00:00:00Z",
  "subtype_notes": null,
  "confidence": "medium",
  "confidence_level": "medium",
  "confidence_basis": "Assembled conservatively from multiple official U.S. government pages without unsupported inference.",
  "validation_notes": [],
  "source_version": "us_official_seed_2026-04-04_v1",
  "requires_human_review": false
}
