{
  "visa_code": "TN",
  "visa_subtype": null,
  "subtype": null,
  "official_name": "USMCA Professional",
  "visa_family": "nonimmigrant",
  "category_group": null,
  "jurisdiction": "United States",
  "purpose": "Temporary professional employment for qualified Canadian and Mexican professionals under the USMCA.",
  "who_can_apply": [],
  "petitioner_required": false,
  "sponsor_required": true,
  "petition_form": [],
  "labor_certification_required": null,
  "lca_required": null,
  "uscis_petition_required": false,
  "sevis_required": null,
  "sevis_program_sponsorship_required": null,
  "treaty_required": true,
  "treaty_nationality_required": true,
  "treaty_nationalities": [],
  "treaty_nationality_note": "Available only to citizens of Canada or Mexico in qualifying professions.",
  "derivative_visas": [],
  "derivative_categories": [],
  "work_authorization": true,
  "work_authorized": true,
  "study_authorization": false,
  "study_authorized": false,
  "dual_intent": false,
  "cap_quota_status": "none",
  "numerical_cap": null,
  "lottery_based": false,
  "lottery_notes": null,
  "visa_bulletin_applicable": false,
  "aos_chart_behavior": null,
  "adjustment_of_status_possible": true,
  "consular_processing_possible": true,
  "initial_validity": null,
  "extension_renewal_basics": "Renewal depends on continuing temporary professional eligibility.",
  "extension_rules": "Renewal depends on continuing temporary professional eligibility.",
  "premium_processing_possible": null,
  "core_eligibility_requirements": [
    "Canadian or Mexican citizenship",
    "Qualifying profession",
    "Supporting employer letter",
    "Required credentials"
  ],
  "hard_disqualifiers": [
    "Not a Canadian or Mexican citizen",
    "Profession not on USMCA list"
  ],
  "required_documents": [
    "Passport",
    "Employer support letter",
    "Degree or license evidence",
    "DS-160 where consular processing applies"
  ],
  "common_denial_reasons": [
    "Profession not qualifying",
    "Credentials insufficient",
    "Temporary intent not established"
  ],
  "official_forms": [
    "I-129",
    "DS-160"
  ],
  "official_source_urls": [
    "https://travel.state.gov/content/travel/en/us-visas/visa-information-resources/all-visa-categories.html",
    "https://www.uscis.gov/working-in-the-united-states/temporary-workers/tn-nafta-professionals"
  ],
  "source_notes": [],
  "last_verified_at": "2026-04-04T00:00:00Z",
  "subtype_notes": null,
  "confidence": "high",
  "confidence_level": "high",
  "confidence_basis": "Directly stated on a category-specific official U.S. government page or an official category page plus a directly applicable USCIS/State process page.",
  "validation_notes": [],
  "source_version": "us_official_seed_2026-04-04_v1",
  "requires_human_review": false
}
