{
  "visa_code": "L-1B",
  "visa_subtype": null,
  "subtype": null,
  "official_name": "Intracompany Transferee Specialized Knowledge Worker",
  "visa_family": "nonimmigrant",
  "category_group": null,
  "jurisdiction": "United States",
  "purpose": "Temporary transfer of an employee with specialized knowledge to a U.S. office.",
  "who_can_apply": [],
  "petitioner_required": true,
  "sponsor_required": true,
  "petition_form": [],
  "labor_certification_required": null,
  "lca_required": null,
  "uscis_petition_required": true,
  "sevis_required": null,
  "sevis_program_sponsorship_required": null,
  "treaty_required": null,
  "treaty_nationality_required": null,
  "treaty_nationalities": [],
  "treaty_nationality_note": null,
  "derivative_visas": [],
  "derivative_categories": [],
  "work_authorization": true,
  "work_authorized": true,
  "study_authorization": false,
  "study_authorized": false,
  "dual_intent": true,
  "cap_quota_status": "none",
  "numerical_cap": null,
  "lottery_based": false,
  "lottery_notes": null,
  "visa_bulletin_applicable": false,
  "aos_chart_behavior": null,
  "adjustment_of_status_possible": true,
  "consular_processing_possible": true,
  "initial_validity": null,
  "extension_renewal_basics": "Initial and extension periods are governed by L-1 rules and specialized-knowledge petition approval.",
  "extension_rules": "Initial and extension periods are governed by L-1 rules and specialized-knowledge petition approval.",
  "premium_processing_possible": null,
  "core_eligibility_requirements": [
    "Qualifying corporate relationship",
    "One year of qualifying employment abroad",
    "Specialized knowledge role in the United States"
  ],
  "hard_disqualifiers": [
    "No qualifying relationship",
    "Specialized knowledge not established"
  ],
  "required_documents": [
    "Passport",
    "Form I-129 support",
    "Corporate relationship evidence",
    "Specialized knowledge evidence"
  ],
  "common_denial_reasons": [
    "Insufficient specialized-knowledge evidence",
    "Corporate relationship not established"
  ],
  "official_forms": [
    "I-129",
    "DS-160"
  ],
  "official_source_urls": [
    "https://travel.state.gov/content/travel/en/us-visas/visa-information-resources/all-visa-categories.html",
    "https://www.uscis.gov/working-in-the-united-states/temporary-workers/l-1a-intracompany-transferee-executive-or-manager"
  ],
  "source_notes": [],
  "last_verified_at": "2026-04-04T00:00:00Z",
  "subtype_notes": "Uses the same L-1 framework but requires specialized-knowledge evidence rather than executive or managerial capacity.",
  "confidence": "medium",
  "confidence_level": "medium",
  "confidence_basis": "Assembled conservatively from multiple official U.S. government pages without unsupported inference.",
  "validation_notes": [],
  "source_version": "us_official_seed_2026-04-04_v1",
  "requires_human_review": false
}
